number,value,datetime_start,datetime_complete,duration,params_batch_size,params_channels,params_dropout,params_lr,params_weight_decay,user_attrs_val_acc,system_attrs_fixed_params,system_attrs_tpe:relative_params:0,state
0,0.9842712448104005,2026-10-04 14:15:57.029117,2026-10-04 14:16:20.586887,0 days 00:00:23.557770,64,medium,0.3,0.001,0.0001,0.9836956521739131,"{'lr': 0.001, 'batch_size': 64, 'channels': 'medium', 'dropout': 0.3, 'weight_decay': 0.0001}",,COMPLETE
1,0.9856507757712293,2026-10-04 14:16:20.938400,2026-10-04 14:16:47.230641,0 days 00:00:26.292241,32,small,0.4330880728874676,0.00043284502212938834,0.00025378155082656634,0.9850543478260869,,,COMPLETE
2,0.9855309127575306,2026-10-04 14:16:47.589250,2026-10-04 14:17:11.156986,0 days 00:00:23.567736,64,small,0.15212112147976886,0.0015958573588141277,0.0001256104370001356,0.9850543478260869,,,COMPLETE
3,0.9882697900058597,2026-10-04 14:17:11.522660,2026-10-04 14:17:42.441311,0 days 00:00:30.918651,64,wide,0.3925879806965068,0.0005418282319533242,6.290644294586145e-06,0.9877717391304348,,,COMPLETE
4,0.9509086460395489,2026-10-04 14:17:42.761517,2026-10-04 14:17:55.254970,0 days 00:00:12.493453,128,wide,0.4828160165372797,0.000747599299995651,0.0017123375973163992,,,,PRUNED
5,0.9403760161165577,2026-10-04 14:18:05.820499,2026-10-04 14:18:16.593805,0 days 00:00:10.773306,64,medium,0.45466020103939103,0.00032925293631105276,1.0842262717330169e-05,,,,PRUNED
6,0.9399372219702973,2026-10-04 14:18:27.041550,2026-10-04 14:18:36.776659,0 days 00:00:09.735109,128,medium,0.46974947078209456,0.0013353819088790589,0.003795853142670641,,,,PRUNED
7,0.633894312204165,2026-10-04 14:18:47.336476,2026-10-04 14:19:00.654785,0 days 00:00:13.318309,32,wide,0.13567451588694796,0.0010370844668954541,0.0020651425578959264,,,,PRUNED
8,0.8135415438023691,2026-10-04 14:19:11.105735,2026-10-04 14:19:29.614280,0 days 00:00:18.508545,64,wide,0.3861223846483287,0.00040375061884407573,6.235377135673162e-06,,,,PRUNED
9,0.9338100610720341,2026-10-04 14:19:40.039740,2026-10-04 14:19:51.207067,0 days 00:00:11.167327,32,small,0.05793452976256486,0.00010218376758008094,0.0028340904295147754,,,,PRUNED
10,0.9392362208041112,2026-10-04 14:20:01.646786,2026-10-04 14:20:14.232210,0 days 00:00:12.585424,64,wide,0.20860134473868627,0.0003415108644978511,0.001183502691389447,,,"{""batch_size"": 64, ""channels"": ""wide"", ""dropout"": 0.20860134473868627, ""lr"": 0.0003415108644978511, ""weight_decay"": 0.001183502691389447}",PRUNED
11,0.9774763565636375,2026-10-04 14:20:24.801963,2026-10-04 14:20:40.107475,0 days 00:00:15.305512,32,small,0.3268963076809587,0.000609827260897067,0.0002888312485023287,,,"{""batch_size"": 32, ""channels"": ""small"", ""dropout"": 0.3268963076809587, ""lr"": 0.000609827260897067, ""weight_decay"": 0.0002888312485023287}",PRUNED
